{
  "handoff_version": "1.0",
  "contract_version": "1.0",
  "provider_id": "dev.openeos.control",
  "provider_version": "0.5.0",
  "session_id": "session-demo-handoff-0001",
  "items": [
    {
      "descriptor": {
        "contract_version": "1.0",
        "provider_id": "dev.openeos.control",
        "provider_version": "0.5.0",
        "session_id": "session-demo-handoff-0001",
        "media_id": "media-demo-jpeg-0001",
        "capture_correlation_id": "capture-demo-0001",
        "captured_at": "2026-08-21T12:34:56+08:00",
        "filename": "DEMO0001.JPG",
        "media_kind": "JPEG",
        "mime_type": "image/jpeg",
        "byte_length": 4096,
        "source_checksum": {
          "algorithm": "SHA-256",
          "value": "aaaaaaaaaaaaaaaaaaaaaaaaaaaaaaaaaaaaaaaaaaaaaaaaaaaaaaaaaaaaaaaa",
          "scope": "FULL_ORIGINAL"
        },
        "source_revision": "revision-demo-jpeg-0001",
        "camera_id": "camera-session-0001",
        "camera_model": "Canon EOS R6 Mark III",
        "storage_id": "storage-session-card1",
        "storage_label": "Card 1",
        "width": 6000,
        "height": 4000,
        "orientation": 1,
        "capture_group_hint": "capture-demo-0001",
        "companion_role": "JPEG",
        "available_representations": ["ORIGINAL"],
        "range_supported": true,
        "resume_supported": false,
        "cancel_supported": false
      },
      "representations": [
        {
          "representation": "ORIGINAL",
          "content_uri": "content://dev.openeos.control.camera_import/camera-import/session-demo/DEMO0001.JPG"
        }
      ]
    }
  ]
}
